{
  "schema-version": 1,
  "router": "sage",
  "default-threshold": 40,
  "scoring": {
    "exact-match": 100,
    "alias-match": 80,
    "keyword-hit": 8,
    "negative-hit": -12,
    "namespace-hit": 10,
    "host-unsupported": -100
  },
  "routes": [
    {
      "skill": "verify-security",
      "kind": "tool",
      "priority": 95,
      "namespace": "security",
      "supported-hosts": [
        "claude",
        "codex",
        "gemini"
      ],
      "activation": {
        "intent-tags": [
          "validate"
        ],
        "trigger-keywords": [
          "安全扫描",
          "安全体检",
          "安全校验",
          "漏洞扫描",
          "漏洞审查",
          "security check",
          "security scan",
          "verify-security",
          "vulnerability review",
          "vulnerability scan"
        ],
        "negative-keywords": [],
        "requires-explicit-invocation": true
      },
      "conflicts-with": [],
      "auto-chain": [],
      "aliases": [
        "安全校验",
        "security-audit",
        "vs"
      ],
      "rationale": {
        "primary-intent": "deterministic validation/tool execution",
        "why-this-route": "verify-security is explicit-invocation-first; it should win only when explicitly requested or when deterministic validation intent is unambiguous.",
        "wins-when": [
          "verify-security",
          "security scan",
          "vulnerability scan",
          "安全扫描",
          "漏洞扫描",
          "安全校验",
          "security check",
          "vulnerability review",
          "vs",
          "security-audit"
        ],
        "avoid-when": [],
        "boundary-notes": "Apply one-question clarification when intent is mixed and adjacent routes are plausible. No declared conflicts-with entries."
      },
      "confidence": {
        "minimum-score": 65,
        "strong-score": 80,
        "very-strong-score": 93,
        "requires-fallback-below-minimum": true
      },
      "fallback": {
        "mode": "do-not-auto-route",
        "clarify-question": "Do you want explicit invocation of verify-security?",
        "default-action": "wait-for-explicit-invocation"
      }
    },
    {
      "skill": "pre-merge-gate",
      "kind": "guard",
      "priority": 94,
      "namespace": "guard",
      "supported-hosts": [
        "claude",
        "codex",
        "gemini"
      ],
      "activation": {
        "intent-tags": [
          "release",
          "validate"
        ],
        "trigger-keywords": [
          "发布门禁",
          "合并检查",
          "合并门禁",
          "合并前检查",
          "merge check",
          "merge gate",
          "pre-merge",
          "release gate"
        ],
        "negative-keywords": [],
        "requires-explicit-invocation": true
      },
      "conflicts-with": [],
      "auto-chain": [
        "verify-change",
        "verify-quality",
        "verify-security"
      ],
      "aliases": [
        "合并门禁",
        "merge-gate"
      ],
      "rationale": {
        "primary-intent": "pre-merge release gate enforcement",
        "why-this-route": "pre-merge-gate is explicit-invocation-first; it should win only when explicitly requested or when deterministic validation intent is unambiguous.",
        "wins-when": [
          "pre-merge",
          "merge gate",
          "release gate",
          "合并前检查",
          "合并门禁",
          "发布门禁",
          "merge check",
          "合并检查",
          "merge-gate"
        ],
        "avoid-when": [],
        "boundary-notes": "Guard route is explicit-only and should not replace normal design/implementation routing unless merge gate is requested. No declared conflicts-with entries."
      },
      "confidence": {
        "minimum-score": 65,
        "strong-score": 80,
        "very-strong-score": 93,
        "requires-fallback-below-minimum": true
      },
      "fallback": {
        "mode": "do-not-auto-route",
        "clarify-question": "Do you want explicit invocation of pre-merge-gate?",
        "default-action": "wait-for-explicit-invocation"
      }
    },
    {
      "skill": "manage-skill",
      "kind": "tool",
      "priority": 92,
      "namespace": "system",
      "supported-hosts": [
        "claude",
        "codex",
        "gemini"
      ],
      "activation": {
        "intent-tags": [
          "validate"
        ],
        "trigger-keywords": [
          "创建技能",
          "更新技能",
          "归档技能",
          "删除技能",
          "维护技能",
          "archive skill",
          "create skill",
          "delete skill",
          "manage-skill",
          "skill crud",
          "update skill"
        ],
        "negative-keywords": [
          "单点缺陷",
          "普通功能开发",
          "ordinary feature",
          "single bug"
        ],
        "requires-explicit-invocation": true
      },
      "conflicts-with": [],
      "auto-chain": [],
      "aliases": [
        "技能管理",
        "skill-admin",
        "skill-crud"
      ],
      "rationale": {
        "primary-intent": "authoritative skill tree CRUD",
        "why-this-route": "manage-skill should win only when the request explicitly asks to create, inspect, update, archive, or delete core skills inside the authoritative skill system tree.",
        "wins-when": [
          "manage-skill",
          "skill crud",
          "create skill",
          "update skill",
          "archive skill",
          "delete skill",
          "skill-admin",
          "skill-crud",
          "维护技能",
          "创建技能",
          "更新技能",
          "删除技能",
          "归档技能",
          "技能管理"
        ],
        "avoid-when": [
          "ordinary feature",
          "single bug",
          "普通功能开发",
          "单点缺陷"
        ],
        "boundary-notes": "Use for core skill create/read/update/delete work inside personal-skill-system/skills; broader system redesign still belongs to skill-evolution."
      },
      "confidence": {
        "minimum-score": 65,
        "strong-score": 80,
        "very-strong-score": 93,
        "requires-fallback-below-minimum": true
      },
      "fallback": {
        "mode": "do-not-auto-route",
        "clarify-question": "Do you want explicit invocation of manage-skill for authoritative skill CRUD?",
        "default-action": "wait-for-explicit-invocation"
      },
      "expert-modules": [
        "skill-management-authoritative-crud"
      ]
    },
    {
      "skill": "pre-commit-gate",
      "kind": "guard",
      "priority": 92,
      "namespace": "guard",
      "supported-hosts": [
        "claude",
        "codex",
        "gemini"
      ],
      "activation": {
        "intent-tags": [
          "release",
          "validate"
        ],
        "trigger-keywords": [
          "提交检查",
          "提交门禁",
          "提交前检查",
          "commit gate",
          "pre commit check",
          "pre-commit"
        ],
        "negative-keywords": [],
        "requires-explicit-invocation": true
      },
      "conflicts-with": [],
      "auto-chain": [
        "verify-change",
        "verify-quality"
      ],
      "aliases": [
        "提交门禁",
        "commit-gate"
      ],
      "rationale": {
        "primary-intent": "pre-commit policy gate enforcement",
        "why-this-route": "pre-commit-gate is explicit-invocation-first; it should win only when explicitly requested or when deterministic validation intent is unambiguous.",
        "wins-when": [
          "pre-commit",
          "commit gate",
          "提交前检查",
          "提交门禁",
          "pre commit check",
          "提交检查",
          "commit-gate"
        ],
        "avoid-when": [],
        "boundary-notes": "Guard route is explicit-only and should not override ordinary execution routes unless user asks for gate checks. No declared conflicts-with entries."
      },
      "confidence": {
        "minimum-score": 65,
        "strong-score": 80,
        "very-strong-score": 93,
        "requires-fallback-below-minimum": true
      },
      "fallback": {
        "mode": "do-not-auto-route",
        "clarify-question": "Do you want explicit invocation of pre-commit-gate?",
        "default-action": "wait-for-explicit-invocation"
      }
    },
    {
      "skill": "gen-docs",
      "kind": "tool",
      "priority": 90,
      "namespace": "documentation",
      "supported-hosts": [
        "claude",
        "codex",
        "gemini"
      ],
      "activation": {
        "intent-tags": [
          "validate"
        ],
        "trigger-keywords": [
          "生成文档",
          "生成DESIGN",
          "生成README",
          "文档脚手架",
          "文档生成器",
          "design scaffold",
          "doc scaffold",
          "docs generator",
          "gen-docs",
          "generate docs",
          "readme scaffold",
          "README骨架"
        ],
        "negative-keywords": [
          "仅评审",
          "review-only"
        ],
        "requires-explicit-invocation": false
      },
      "conflicts-with": [],
      "auto-chain": [],
      "aliases": [
        "文档生成",
        "doc-generator"
      ],
      "rationale": {
        "primary-intent": "deterministic documentation scaffold generation",
        "why-this-route": "gen-docs should win when prompt intent aligns with deterministic documentation scaffold generation and positive route signals outweigh adjacent candidates.",
        "wins-when": [
          "gen-docs",
          "generate docs",
          "doc scaffold",
          "readme scaffold",
          "design scaffold",
          "生成文档",
          "文档脚手架",
          "生成README",
          "doc-generator",
          "文档生成"
        ],
        "avoid-when": [
          "review-only",
          "仅评审"
        ],
        "boundary-notes": "Use gen-docs for scaffold generation; structural validation belongs to verify-module. No declared conflicts-with entries."
      },
      "confidence": {
        "minimum-score": 40,
        "strong-score": 55,
        "very-strong-score": 68,
        "requires-fallback-below-minimum": true
      },
      "fallback": {